,movie_id,title,tags
446,1701,Con Air,"when the govern put all it rotten crimin egg in one airborn basket, it' ask for trouble. befor you can say, ""pass the barf bag,"" the crook control the plane, led by creepi cyru ""the virus"" grissom. watch hi everi move is the just-releas cameron poe, who'd rather reunit with hi family. action thriller crime prison ambush helicopt airport ga station undercov mexican standoff braveri hijack escap shootout u.s. marshal la vega explos brutal violenc convict desert war hero dea agent motorcycl chase nicola cage john cusack john malkovich simon west"
447,13027,Eagle Eye,"jerri shaw and rachel holloman are two stranger whose live are suddenli thrown into turmoil by a mysteri woman they have never met. threaten their live and family, the unseen caller use everyday technolog to control their action and push them into increas danger. as event escalate, jerri and rachel becom the country' most-want fugit and must figur out what is happen to them. mysteri thriller action artifici intellig washington d.c. secret ident hostag technolog fbi pentagon twin brother fbi agent shia labeouf michel monaghan rosario dawson d.j. caruso"
448,2289,Cold Mountain,"in thi classic stori of love and devot set against the backdrop of the american civil war, a wound confeder soldier name w.p. inman desert hi unit and travel across the south, aim to return to hi young wife, ada, who he left behind to tend their farm. as inman make hi peril journey home, ada struggl to keep their home intact with the assist of ruby, a mysteri drifter sent to help her by a kindli neighbor. drama loss of lover loss of famili desert loss of father love of one' life jude law nicol kidman rené zellweg anthoni minghella"
449,20504,The Book of Eli,"a post-apocalypt tale, in which a lone man fight hi way across america in order to protect a sacr book that hold the secret to save humankind. action thriller scienc fiction book post-apocalypt dystopia faith blind denzel washington gari oldman mila kuni albert hugh"
450,9574,Flubber,"professor phillip brainard, an absent mind professor, work with hi assist weebo, tri to creat a substanc that' a new sourc of energi and that will save medfield colleg where hi sweetheart sara is the president. he ha miss hi wed twice, and on the afternoon of hi third wedding, professor brainard creat flubber, which allow object to fli through the air. comedi famili scienc fiction wed vow inventor slime green flight mad scientist wed robin william marcia gay harden christoph mcdonald le mayfield"
451,11618,The Haunting,"dr. david marrow invit nell vance, and theo and luke sanderson to the eeri and isol hill hous to be subject for a sleep disord study. the unfortun guest discov that marrow is far more interest in the sinist mansion itself – and they soon see the true natur of it horror. horror thriller fantasi mysteri base on novel trauma castl haunt hous insomnia bone poster paint remak haunt child labor audio record spiral staircas evil loner research insomniac paranorm activ logbook strang nois spook cherub liam neeson catherin zeta-jon owen wilson jan de bont"
452,2300,Space Jam,"in a desper attempt to win a basketbal match and earn their freedom, the looney tune seek the aid of retir basketbal champion, michael jordan. anim comedi drama famili fantasi sport basketbal doctor basketbal team basketbal game refere basketbal court tweeti bird speedi gonzal cartoon chicken sylvest the cat cartoon realiti crossov basketbal hoop cartoon skunk michael jordan wayn knight billi west joe pytka"
453,12096,The Pink Panther,"when the coach of the franc soccer team is kill by a poison dart in the stadium in the end of a game, and hi expens and huge ring with the diamond pink panther disappears, the ambiti chief inspector dreyfu assign the worst polic inspector jacqu clouseau to the case. action comedi crime mysteri famili robberi investig inspector killer clouseau pink panther murder hunt steve martin kevin kline jean reno shawn levi"
454,10200,The Day the Earth Stood Still,"a repres of an alien race that went through drastic evolut to surviv it own climat change, klaatu come to earth to assess whether human can prevent the environment damag they have inflict on their own planet. when bar from speak to the unit nations, he decid humankind shall be extermin so the planet can survive. drama scienc fiction thriller extraterrestri technolog spacecraft ultimatum evacu panic govern remak ufo alien end of the world giant robot tank social commentari power outag interrog environment threat alien contact central park messeng nanobot disintegr keanu reev jennif connelli kathi bate scott derrickson"
455,8834,Conspiracy Theory,"a man obsess with conspiraci theori becom a target after one of hi theori turn out to be true. unfortunately, in order to save himself, he ha to figur out which theori it is. action drama mysteri thriller new york cia helicopt assassin secret obsess taxi driver fbi paranoia wheelchair chase theori polit govern control cover-up murder suspens conspiraci tortur flashback target geronimo newslett mel gibson julia robert patrick stewart richard donner"
456,228150,Fury,"last month of world war ii in april 1945. as the alli make their final push in the european theater, a battle-harden u.s. armi sergeant in the 2nd armor divis name wardaddi command a sherman tank call ""fury"" and it five-man crew on a deadli mission behind enemi lines. outnumb and outgunned, wardaddi and hi men face overwhelm odd in their heroic attempt to strike at the heart of nazi germany. war drama action world war ii nazi war nazi germani panzer tank brad pitt shia labeouf logan lerman david ayer"
457,6068,Six Days Seven Nights,"when quinn, a grouchi pilot live the good life in the south pacific, agre to transfer a savvi fashion editor, robin, to tahiti, he end up strand on a desert island with her after their plane crashes. the pair avoid each other at first, until they'r forc to team up to escap from the island -- and some pirat who want their heads. action adventur comedi romanc overleven famili guy harrison ford ann hech david schwimmer ivan reitman"
458,41515,Yogi Bear,"jellyston park ha been lose business, so greedi mayor brown decid to shut it down and sell the land. that mean famili will no longer be abl to experi the natur beauti of the outdoor -- and, even worse, yogi and boo boo will be toss out of the onli home they'v ever known. face with hi biggest challeng ever, yogi must prove that he realli is ""smarter than the averag bear"" as he and boo boo join forc with their old nemesi ranger smith to find a way to save jellyston park from close forever. comedi famili anim adventur picnic sandwich bear 3d yogi dan aykroyd justin timberlak anna fari eric brevig"
459,9023,Spirit: Stallion of the Cimarron,"as a wild stallion travel across the frontier of the old west, he befriend a young human and find true love with a mare. western anim adventur comedi famili human be freedom mustang rivalri wildlif anim cavalri indian war eyebrow wild hors matt damon jame cromwel daniel studi kelli asburi"
460,38317,Zookeeper,"a comedi about a zookeep who might be great with animals, but he doesn't know anyth about the bird and the bees. the man can't find love, so he decid to quit hi job at the zoo, but hi anim friend tri to stop him and teach him that mother natur know best when it come to love. comedi romanc famili talk anim scientist german accent ostrich monkey bullfrog car dealership duringcreditssting kevin jame rosario dawson sylvest stallon frank coraci"
461,2157,Lost in Space,"the prospect for continu life on earth in the year 2058 are grim. so the robinson are launch into space to colon alpha prime, the onli other inhabit planet in the galaxy. but when a stowaway sabotag the mission, the robinson find themselv hurtl through unchart space. adventur famili scienc fiction time travel sabotag deep space explor gari oldman william hurt matt leblanc stephen hopkin"
462,14462,The Manchurian Candidate,"when hi armi unit wa ambush dure the first gulf war, sergeant raymond shaw save hi fellow soldier just as hi command officer, then-captain ben marco, wa knock unconscious. broker the incid for polit capital, shaw eventu becom a vice-presidenti nominee, while marco is haunt by dream of what happen -- or didn't happen -- in kuwait. as marco (now a major) investigates, the stori begin to unravel, to the point where he question if it happen at all. is it possibl the entir unit wa kidnap and brainwash to believ shaw is a war hero as part of a plot to seiz the white house? some veri power peopl at manchurian global corpor appear desper to stop him from find out. drama thriller mysteri senat gulf war cano kuwait conspiraci war hero u.s. congress implant denzel washington meryl streep liev schreiber jonathan demm"
463,161795,Déjà Vu,"l.a. shop owner dana and englishman sean meet and fall in love at first sight, but sean is marri and dana is to marri her busi partner alex. romanc drama love american pin stranger rubi stephen dillan victoria foyt vanessa redgrav henri jaglom"
464,159824,Hotel Transylvania 2,"when the old-old-old-fashion vampir vlad arriv at the hotel for an impromptu famili get-together, hotel transylvania is in for a collis of supernatur old-school and modern day cool. anim comedi famili transylvania hotel witch technolog magic mummi dracula skeleton onli child backpack marriag frankenstein wolfman zombi move out invis man new life adam sandler andi samberg selena gomez genndi tartakovski"
465,49948,Fantasia 2000,"blend live music and brilliant animation, thi sequel to the origin 'fantasia' restor 'the sorcerer' apprentice' and add seven new shorts. anim famili music orchestra music segment steve martin itzhak perlman quinci jone jame algar"
466,2135,The Time Machine,"hope to alter the event of the past, a 19th centuri inventor instead travel 800,000 year into the future, where he find humankind divid into two war races. scienc fiction adventur action futur time machin guy pearc mark addi phyllida law simon well"
467,9822,Mighty Joe Young,"as a child live in africa, jill young saw her mother kill while protect wild gorilla from poacher led by andrei strasser. now an adult, jill care for an orphan gorilla name joe -- who, due to a genet anomaly, is 15 feet tall. when gregg o'hara arriv from california and see the animal, he convinc jill that joe would be safest at hi wildlif refuge. but strasser follow them to the u.s., intent on captur joe for himself. action adventur famili fantasi gorilla die and death charliz theron rade serbedzija bill paxton ron underwood"
468,9705,Swordfish,"rogu agent gabriel shear is determin to get hi mitt on $9 billion stash in a secret drug enforc administr account. he want the cash to fight terrorism, but lack the comput skill necessari to hack into the govern mainframe. enter stanley jobson, a n'er-do-wel encrypt expert who can log into anything. action crime thriller femal nuditi hacker terror violenc ex-con wire lo angel intern airport (lax) misdirect aftercreditssting john travolta hugh jackman hall berri domin sena"
469,1656,The Legend of Zorro,"have spent the last 10 year fight injustic and cruelty, alejandro de la vega is now face hi greatest challenge: hi love wife elena ha thrown him out of the house! elena ha file for divorc and found comfort in the arm of count armand, a dash french aristocrat. but alejandro know someth she doesn't: armand is the evil mastermind behind a terrorist plot to destroy the unit states. and so, with hi marriag and the county' futur at stake, it' up to zorro to save two union befor it' too late. action adventur california spi father son relationship mexico hero marriag crisi sword fight divorc american civil war antonio bandera catherin zeta-jon adrián alonso barona martin campbel"
470,12159,What Dreams May Come,"chri neilson die to find himself in a heaven more amaz than he could have ever dream of. there is one thing missing: hi wife. after he dies, hi wife, anni kill herself and went to hell. chri decid to risk etern in hade for the small chanc that he will be abl to bring her back to heaven. drama fantasi romanc paradis soul underworld heaven paint hell afterlif spirit robin william cuba good jr. annabella sciorra vincent ward"
471,9678,Little Nicky,"after the lord of dark decid he will not cede hi thrown to ani of hi three sons, the two most power of them escap to earth to creat a kingdom for themselves. thi action close the portal filter sin soul to hell and caus satan to wither away. he must send hi most weak but belov son, littl nicky, to earth to return hi brother to hell. comedi fantasi romanc father son relationship brother sister relationship mephisto bulldogg adam sandler patricia arquett harvey keitel steven brill"
472,4442,The Brothers Grimm,"folklor collector and con artists, jake and will grimm, travel from villag to villag pretend to protect townsfolk from enchant creatur and perform exorcisms. however, they are put to the test when they encount a real magic curs in a haunt forest with real magic beings, requir genuin courage. adventur fantasi action comedi thriller brother brother relationship literatur aftercreditssting heath ledger matt damon mackenzi crook terri gilliam"
473,75,Mars Attacks!,"'we come in peace' is not what those green men from mar mean when they invad our planet, arm with irresist weapon and a cruel sens of humor. thi star stud cast must play victim to the alien’ fun and game in thi comedi homag to scienc fiction film of the '50 and '60s. comedi fantasi scienc fiction save the world total destruct white hous mar usa presid cataclysm lasergun ambassador congress pest fli saucer jack nicholson glenn close annett bene tim burton"
474,330770,Evolution,11-year-old nicola live with hi mother in a seasid hous estate. the onli place that ever see ani activ is the hospital. it is there that all the boy from the villag are forc to undergo strang medic trial that attempt to disrupt the phase of evolution. mysteri drama horror nurs sea beach boy pregnant blood woman director max brebant roxan duran julie-mari parmenti lucil hadzihalilov
475,9433,The Edge,"the plane carri wealthi charl mors crash down in the alaskan wilderness. togeth with the two other passengers, photograph robert and assist stephen, charl devis a plan to help them reach civilization. however, hi biggest obstacl might not be the elements, or even the kodiak bear stalk them -- it could be robert, whom charl suspect is have an affair with hi wife and would not mind see him dead. action adventur drama photograph grizzli bear wilder airplan supermodel emerg land suspens surviv bear anim horror alec baldwin anthoni hopkin ell macpherson lee tamahori"
476,19959,Surrogates,"set in a futurist world where human live in isol and interact through surrog robots, a cop is forc to leav hi home for the first time in year in order to investig the murder of others' surrogates. action scienc fiction thriller clone dystopia bruce willi radha mitchel rosamund pike jonathan mostow"
477,11973,Thirteen Days,"dramatis of the cuban missil crisis, the nuclear standoff with the ussr spark by the discoveri by the american of missl base establish on the soviet alli island of cuba. shown from the perspect of the us president, john f kennedy, hi staff and advisors. drama thriller usa presid atom bomb john f. kennedi kubakris threat kevin costner bruce greenwood steven culp roger donaldson"
478,11228,Daylight,a group of arm robber flee the polic head for the new jersey tunnel and run right into truck transport toxic waste. the spectacular explos that follow result in both end of the tunnel collaps and the hand of peopl who surviv the explos are now in peril. kit latura is the onli man with the skill and knowledg to lead the band of survivor out of the tunnel befor the structur collapses. action adventur thriller taxi new jersey helicopt river hero taxi driver race against time guard surviv disast new york citi explos power outag dog trap flood tunnel christma trap underground action hero sylvest stallon ami brenneman viggo mortensen rob cohen
479,77951,Walking With Dinosaurs,"walk with dinosaur 3d is a film depict life-lik 3d dinosaur charact set in photo-r landscap that transport audienc to the prehistor world as it exist 70 million year ago. the film is base on the 1999 documentari televis miniseri walk with dinosaurs, produc by the bbc. walk with dinosaur 3d is be produc by evergreen studios, the compani that produc happi feet, and it is wa releas on octob 11, 2013. anim famili adventur dinosaur 3d charli row justin long karl urban barri cook"
480,5491,Battlefield Earth,"in the year 3000, man is no match for the psychlos, a greedy, manipul race of alien on a quest for ultim profit. led by the power terl, the psychlo are strip earth clean of it natur resources, use the broken remnant of human as slaves. what is left of the human race ha descend into a near primit state. after be captured, it is up to tyler to save mankind. action scienc fiction war base on novel post-apocalypt dystopia mine fighter jet alien invas scientolog cavemen bureaucrat citi ruin john travolta barri pepper forest whitak roger christian"
481,10715,Looney Tunes: Back in Action,"bug bunni and daffi duck are up to their feud way again. tire of play second fiddl to bugs, daffi ha decid to leav the studio for good. he is aid by warner bros.' humor impair vice presid of comedy, kate houghton, who releas him from hi contract and instruct wb secur guard/aspir stunt man dj drake to captur and ""escort"" daffi off the studio lot. anim comedi famili spi duck bunni wretch film industri live action and anim brendan fraser jenna elfman steve martin joe dant"
482,10197,Nine,"arrogant, self-cent movi director guido contini find himself struggl to find meaning, purpose, and a script for hi latest film endeavor. with onli a week left befor shoot begins, he desper search for answer and inspir from hi wife, hi mistress, hi muse, and hi mother. drama music romanc memori sidewalk cafe room key drive a car coastlin stairway search for mean sequin sing photograph slide down a pole costum design duringcreditssting 1960 judi dench daniel day-lewi marion cotillard rob marshal"
483,9562,Timeline,a group of archaeolog student becom trap in the past when they go there to retriev their professor. the group must surviv in 14th centuri franc long enough to be rescued. action adventur scienc fiction professor time travel quantum mechan hundr years' war excav la roqu knight mediev time paul walker franc o'connor gerard butler richard donner
484,9922,The Postman,"in 2013 there are no highways, no i-ways, no dream of a better tomorrow, onli scatter survivor across what wa onc the unit states. into thi apocalypt wasteland come an enigmat drifter with a mule, a knack for shakespear and someth yet undiscovered: the power to inspir hope. drama adventur usa post postman armi apocalyps kevin costner will patton olivia william kevin costner"
485,9447,Babe: Pig in the City,"babe, fresh from hi victori in the sheepherd contest, return to farmer hoggett' farm, but after farmer hoggett is injur and unabl to work, babe ha to go to the big citi to save the farm. adventur comedi drama famili fantasi piggi bank shortag of money pig farm piglet talk anim talk dog dog chimpanze talk pig jame cromwel mari stein mickey rooney georg miller"
486,274854,The Last Witch Hunter,"the modern world hold mani secrets, but by far the most astound is that witch still live among us; viciou supernatur creatur intent on unleash the black death upon the world and put an end to the human race onc and for all. armi of witch hunter have battl thi unnatur enemi for centuries, includ kaulder, a valiant warrior who mani year ago slay the all-pow witch queen, decim her follow in the process. in the moment right befor her death, the queen curs kaulder with immortality, forev separ him from hi belov wife and daughter. today, kaulder is the last live hunter who ha spent hi immort life track down rogu witches, all the while yearn for hi long-lost family. fantasi action adventur new york witch upris witch hunter vin diesel rose lesli elijah wood breck eisner"
487,8870,Red Planet,"astronaut search for solut to save a die earth by search on mars, onli to have the mission go terribl awry. thriller action scienc fiction mar futur astronaut scienc catastroph val kilmer carrie-ann moss benjamin bratt antoni hoffman"
488,9992,Arthur and the Invisibles,"arthur is a spirit ten-year old whose parent are away look for work, whose eccentr grandfath ha been miss for sever years, and who live with hi grandmoth in a countri hous that, in two days, will be repossessed, torn down, and turn into a block of flat unless arthur' grandfath return to sign some paper and pay off the famili debt. arthur discov that the key to success lie in hi own descent into the land of the minimoys, creatur no larger than a tooth, whom hi grandfath help reloc to their garden. somewher among them is hidden a pile of rubies, too. can arthur be of stout heart and save the day? romanc beckon as well, and a villain lurks. adventur fantasi anim famili grandfath grandson relationship wretch treasur hunt disappear famili fantasi world freddi highmor mia farrow ron crawford luc besson"
489,36970,Oceans,"an ecolog drama/documentary, film throughout the globe. part thriller, part medit on the vanish wonder of the sub-aquat world. documentari famili ocean sea fish whale duringcreditssting pierc brosnan jacqu perrin rie miyazawa jacqu perrin"
490,10077,A Sound of Thunder,"when a hunter sent back to the prehistor era run off the path he must not leave, he caus a chain reaction that alter histori in disastr ways. thriller scienc fiction adventur action die and death time travel romanc dinosaur heik makatsch armin rohd david oyelowo peter hyam"
491,76649,Pompeii,"set in 79 a.d., pompeii tell the epic stori of milo, a slave turn invinc gladiat who find himself in a race against time to save hi true love cassia, the beauti daughter of a wealthi merchant who ha been unwillingli betroth to a corrupt roman senator. as mount vesuviu erupt in a torrent of blaze lava, milo must fight hi way out of the arena in order to save hi belov as the onc magnific pompeii crumbl around him. action adventur histori romanc drama gladiat arena gladiat fight lava roman forbidden love natur disast epic disast slave town in panic vulcan volcan erupt pompeii 3d kit harington carrie-ann moss emili brown paul w.s. anderson"
492,293644,Top Cat Begins,top cat ha arriv to charm hi way into your hearts! ever wonder how thi scheme felin got hi start? well top cat begin reveal the origin of everyth you know and love about thi classic comedi hero. what follow is an adventur so crazi that it ha to be seen to be believed! comedi anim 3d jason harri david hoffman bill lobley andré couturi
493,453,A Beautiful Mind,"at princeton university, john nash struggl to make a worthwhil contribut to serv as hi legaci to the world of mathematics. he final make a revolutionari breakthrough that will eventu earn him the nobel prize. after graduat school he turn to teaching, becom romant involv with hi student alicia. meanwhil the govern ask hi help with break soviet codes, which soon get him involv in a terrifi conspiraci plot. nash grow more and more paranoid until a discoveri that turn hi entir world upsid down. now it is onli with alicia' help that he will be abl to recov hi mental strength and regain hi statu as the great mathematician we know him as today.. drama romanc individu schizophrenia massachusett love of one' life intellig mathematician market economi econom theori princeton univers nobel prize mathemat theorem m.i.t. mathemat delus russel crow ed harri jennif connelli ron howard"
494,8587,The Lion King,a young lion cub name simba can't wait to be king. but hi uncl crave the titl for himself and will stop at noth to get it. famili anim drama loss of parent wild boar uncl shaman redempt king scar hyena meerkat jonathan taylor thoma matthew broderick jame earl jone roger aller
495,72545,Journey 2: The Mysterious Island,"sean anderson partner with hi mom' boyfriend on a mission to find hi grandfather, who is thought to be miss on a mythic island. adventur action scienc fiction mission mysteri island miss person duringcreditssting 3d dwayn johnson josh hutcherson kristin davi brad peyton"
496,109451,Cloudy with a Chance of Meatballs 2,"after the disastr food storm in the first film, flint and hi friend are forc to leav the town. flint accept the invit from hi idol chester v to join the live corp company, which ha been task to clean the island, and where the best inventor in the world creat technolog for the better of mankind. when flint discov that hi machin still oper and now creat mutant food beast like live pickles, hungri tacodiles, shrimpanze and appl pie-thons, he and hi friend must return to save the world. anim famili comedi inventor food scientist bill hader anna fari jame caan codi cameron"
497,9533,Red Dragon,"former fbi agent will graham, who wa onc almost kill by the savag hannib 'the cannibal' lecter, now ha no choic but to face him again, as it seem lecter is the onli one who can help graham track down a new serial killer. crime thriller horror psychopath serial killer fbi agent anthoni hopkin edward norton ralph fienn brett ratner"
498,2023,Hidalgo,"set in 1890, thi is the stori of a poni express courier who travel to arabia to compet with hi horse, hidalgo, in a danger race for a massiv contest prize, in an adventur that send the pair around the world... western adventur hors race hors racehors viggo mortensen zuleikha robinson omar sharif joe johnston"
