,movie_id,title,tags
924,10320,The Ring Two,rachel keller must prevent evil samara from take possess of her son' soul. drama horror thriller nun base on novel bath tub nightmar son sequel remak vision good vs evil woman report mental institut videotap evil child naomi watt simon baker elizabeth perkin hideo nakata
925,50646,"Crazy, Stupid, Love.","cal weaver is live the american dream. he ha a good job, a beauti house, great children and a beauti wife, name emily. cal' seemingli perfect life unravels, however, when he learn that emili ha been unfaith and want a divorce. over 40 and suddenli single, cal is adrift in the fickl world of dating. enter, jacob palmer, a self-styl player who take cal under hi wing and teach him how to be a hit with the ladies. comedi drama romanc soulmat midlif crisi marriag crisi woman law school crazi relationship steve carel juliann moor ryan gosl glenn ficarra"
926,8920,Garfield,"garfield, the fat, lazy, lasagna lover, ha everyth a cat could want. but when jon, in an effort to impress the liz - the vet and an old high-school crush - adopt a dog name odi and bring him home, garfield get the one thing he doesn't want. competition. anim comedi famili competit moder lasagn garfield bill murray breckin meyer jennif love hewitt peter hewitt"
927,13673,Christmas with the Kranks,"luther krank is fed up with the commerci of christmas; he decid to skip the holiday and go on a vacat with hi wife instead. but when hi daughter decid at the last minut to come home, he must put togeth a holiday celebration. comedi famili holiday christma tim allen jami lee curti dan aykroyd joe roth"
928,60308,Moneyball,"the stori of oakland athlet gener manag billi beane' success attempt to put togeth a basebal team on a budget, by employ computer-gener analysi to draft hi players. drama underdog base on novel basebal teamwork sport partner meet oakland california strategi voic over statist brad pitt jonah hill philip seymour hoffman bennett miller"
929,6950,Outbreak,"a deadli airborn viru find it way into the usa and start kill off peopl at an epidem rate. col sam daniels' job is to stop the viru spread from a small town, which must be quarantined, and to prevent an over reaction by the white house. action drama scienc fiction thriller river gener research armi serum monkey epidem medic research dustin hoffman rene russo morgan freeman wolfgang petersen"
930,225574,Non-Stop,"bill mark is a burned-out veteran of the air marshal service. he view the assign not as a life-sav duty, but as a desk job in the sky. however, today' flight will be no routin trip. shortli into the transatlant journey from new york to london, he receiv a seri of mysteri text messag order him to have the govern transfer $150 million into a secret account, or a passeng will die everi 20 minutes. action thriller mysteri airplan conspiraci airplan crash cell phone hijack one night mysteri killer liam neeson juliann moor scoot mcnairi jaum collet-serra"
931,13836,Race to Witch Mountain,"a taxi driver get more than he bargain for when he pick up two teen runaways. not onli doe the pair possess supernatur powers, but they'r also tri desper to escap peopl who have made them their targets. adventur famili fantasi scienc fiction thriller action spacecraft laser teleport telekinesi alien militari duringcreditssting supernatur power mountain dwayn johnson annasophia robb alexand ludwig andi fickman"
932,752,V for Vendetta,"in a world in which great britain ha becom a fascist state, a mask vigilant known onli as 'v' conduct guerrilla warfar against the oppress british government. when 'v' rescu a young woman from the secret police, he find in her an alli with whom he can continu hi fight to free the peopl of britain. action thriller fantasi detect vatican fascism satan fascist dystopia govern chancellor reveng personif of satan tortur hatr mask vigilant catholic cathol priest cathol guilt jesuit veng spirit activist irish cathol veng jesuit priest gnostic occult natali portman hugo weav stephen rea jame mcteigu"
933,6038,Shanghai Knights,"the dynam duo of chon wang and roy o'bannon return for anoth crazi adventure. thi time, they'r in london to aveng the murder of chon' father, but end up on an even bigger case. chon' sister is there to do the same, but instead unearth a plot to kill the royal family. no one believ her, though, and it' up to chon and roy (who ha romanc on hi mind) to prove her right. action adventur comedi western london england indian territori emperor reveng murder arrow duringcreditssting imperi seal jacki chan owen wilson fann wong david dobkin"
934,9975,Curious George,"when the man in the yellow hat befriend curiou georg in the jungle, they set off on a non-stop, fun-fil journey through the wonder of the big citi toward the warmth of true friendship. adventur anim comedi famili museum product placement balloon jungl monkey famili predict cargo ship curios will ferrel drew barrymor david cross matthew o'callaghan"
935,11451,Herbie Fully Loaded,"maggi peyton, the new owner of number 53 - the free-wheelin' volkswagen bug with a mind of it own - put the car through it pace on the road to becom a nascar competitor. comedi famili adventur fantasi romanc car race victori car nascar woman director lindsay lohan michael keaton matt dillon angela robinson"
936,12103,Don't Say a Word,"when the daughter of a psychiatrist is kidnapped, he' horrifi to discov that the abductors' demand is that he break through to a post traumat stress disord suffer young woman who know a secret.. thriller cemeteri diamant suspens psychiatrist killer michael dougla sean bean brittani murphi gari fleder"
937,60304,Hansel & Gretel: Witch Hunters,"after get a tast for blood as children, hansel and gretel have becom the ultim vigilantes, hell-bent on retribution. now, unbeknownst to them, hansel and gretel have becom the hunted, and must face an evil far greater than witches... their past. fantasi horror action witch black magic steampunk good vs evil troll extrem violenc violenc witchcraft evil witch hunt witch hunter evil witch duringcreditssting hansel and gretel gun 3d jeremi renner gemma arterton famk janssen tommi wirkola"
938,2251,Unfaithful,"conni is a wife and mother whose 11-year marriag to edward ha lost it sexual spark. when conni liter run into handsom book collector paul, he sweep her into an all-consum affair. but edward soon becom suspici and decid to confront the other man. thriller drama adulteri infidel erotic literatur lover new york citi erot thriller richard gere dian lane olivi martinez adrian lyne"
939,46529,I Am Number Four,"a teenag fugit with an incred secret race to stay one step ahead of the mysteri forc seek destroy him in thi sci-fi action thriller. with three dead and one on the run, the race to find the elus number four begins. outwardli normal teen john smith never get too comfort in the same identity, and along with hi guardian, henri, he is constantli move from town to town. with each pass day, john gain a stronger grasp on hi extraordinari new powers, and hi bond to the be that share hi fantast fate grow stronger. action thriller scienc fiction adventur secret ident alien teenag boy teenag hero alien teenag interspeci romanc base on young adult novel superpow alex pettyf timothi olyph teresa palmer d.j. caruso"
940,231,Syriana,"the middl eastern oil industri is the backdrop of thi tens drama, which weav togeth numer stori lines. bennett holiday is an american lawyer in charg of facilit a dubiou merger of oil companies, while bryan woodman, a switzerland-bas energi analyst, experi both person tragedi and opportun dure a visit with arabian royalty. meanwhile, veteran cia agent bob barn uncov an assassin plot with unsettl origins. drama thriller anti terror bomb assassin middl east lebanon cia capit global loss of son persia war against terror energi polici petrol georg clooney matt damon jeffrey wright stephen gaghan"
941,300671,13 Hours: The Secret Soldiers of Benghazi,an american ambassador is kill dure an attack at a u.s. compound in libya as a secur team struggl to make sens out of the chaos. action drama histori thriller war base on novel assault rifl mercenari libya biographi base on true stori heroism explos american abroad death 21st centuri cia agent u.s. ambassador jame badg dale john krasinski max martini michael bay
942,228326,The Book of Life,"the journey of manolo, a young man who is torn between fulfil the expect of hi famili and follow hi heart. befor choos which path to follow, he embark on an incred adventur that span three fantast world where he must face hi greatest fears. romanc anim adventur comedi famili fantasi love triangl afterlif day of the dead bullfight diego luna chan tatum zoe saldana jorg r. gutierrez"
943,9754,Firewall,"state-of-the-art secur system creator, jack stanfield ha cement hi reput as a man who' thought of everything. but when a crimin find a way into jack' person life, everyth jack hold dear is suddenli at stake. thriller bank technolog blackmail hacker seattl comput hacker firewal harrison ford paul bettani virginia madsen richard loncrain"
944,66,Absolute Power,a master thief coincident is rob a hous where a murder in which the presid of the unit state is involv occur in front of hi eyes. he is forc to run yet may hold evid that could convict the president. a polit thriller from and star clint eastwood and base on a novel by david baldacci. crime drama thriller corrupt assassin washington d.c. rape white hous usa presid daughter govern suspens secret servic secret servic agent clint eastwood gene hackman ed harri clint eastwood
945,4421,G.I. Jane,a femal senat succe in enrol a woman into combin reconnaiss team train where everyon expect her to fail. action drama poem middl east helicopt satellit navi sexism war armi sexual harass navi seal feminist soldier commando mental health drill instructor militari u.s. militari armi base reconnaiss sexual discrimin demi moor viggo mortensen ann bancroft ridley scott
946,2649,The Game,"in honor of hi birthday, san francisco banker nichola van orton, a financi geniu and a coldheart loner, receiv an unusu present from hi younger brother, conrad -- a gift certif to play a uniqu kind of game. in nearli a nanosecond, nichola find himself consum by a danger set of ever-chang rules, unabl to distinguish where the charad end and realiti begins. drama thriller mysteri brother brother relationship birthday danger of life birthday parti surpris michael dougla sean penn deborah kara unger david fincher"
947,588,Silent Hill,"the eeri and desert ghost town of silent hill draw a young mother desper to find a cure for her onli child' illness. unabl to accept the doctor' diagnosi that her daughter should be perman institution for psychiatr care, rose flee with her child, head for the abandon town in search of answer – and ignor the protest of her husband. it' soon clear thi place is unlik anywher she' ever been. it' smother by fog, inhabit by a varieti of strang be and period overcom by a live 'darkness' that liter transform everyth it touches. as rose search for her littl girl, she begin to learn the histori of the strang town and realiz that her daughter is just a pawn in a larger game. horror mysteri monster mother role burn of witch fog suffer dark sadism supernatur reveng surreal gore surviv good vs evil blood anoth dimens tortur creatur violenc demon witch burn base on video game dismember religi fanat ghost town sleepwalk radha mitchel sean bean lauri holden christoph gan"
948,10393,The Replacements,"maverick old-guard coach jimmi mcginti is hire in the wake of a players' strike to help the washington sentinel advanc to the playoffs. but that imposs dream hing on whether hi replac can hunker down and do the job. so, mcginti dust off hi secret dossier of ex-play who never got a chanc (or screw up the one they were given) and knit togeth a bad-dream team of guy who just may give the sentinel their titl shot. comedi american footbal strike sport coach misfit american footbal player keanu reev gene hackman brook langton howard deutch"
949,71552,American Reunion,"the charact we met a littl more than a decad ago are return to east great fall for their high-school reunion. in one long-overdu weekend, they will discov what ha changed, who hasn’t and that time and distanc can’t break the bond of friendship. it wa summer 1999 when four small-town michigan boy began a quest to lose their virginity. in the year that have passed, jim and michel marri while kevin and vicki said goodbye. oz and heather grew apart, but finch still long for stifler’ mom. now these lifelong friend have come home as adult to reminisc about – and get inspir by – the hormon teen who launch a comedi legend. comedi wife husband relationship sequel famili reunion masturb scat high school reunion quit a job milf duringcreditssting jason bigg alyson hannigan seann william scott jon hurwitz"
950,9631,The Negotiator,"the polic tri to arrest expert hostag negoti danni roman, who insist he' be frame for hi partner' murder in what he believ is an elabor conspiracy. think there' evid in the intern affair offic that might clear him, he take everyon in the offic hostag and demand that anoth well-known negoti be brought in to handl the situat and secretli investig the conspiracy. action adventur crime drama mysteri thriller corrupt hostag pension innoc polic hostage-tak murder suspens conspiraci bullet wound negoti samuel l. jackson kevin spacey david mors f. gari gray"
951,216282,Into the Storm,"the town of silverton is in one day destroy by the unpreced power of a seri of tornadoes. the popul is at the merci of the unpredict and deadli cyclones, while hunter warn that the worst is yet to come. most peopl find shelter, but some just go to the tornado for that one, uniqu shot. action thriller tornado student found footag disast movi richard armitag sarah wayn calli matt walsh steven qual"
952,306,Beverly Hills Cop III,"back in sunni southern california and on the trail of two murderers, axel foley again team up with la cop billi rosewood. soon, they discov that an amus park is be use as a front for a massiv counterfeit ring – and it' run by the same gang that shot billy' boss. action comedi crime detect undercov secur camera carousel investig weapon sequel rescu counterfeit shootout dirti cop gunfight lo angel explos violenc foot chase frame car chase secret servic amus park roller coaster beverli hill buddi comedi eddi murphi judg reinhold héctor elizondo john landi"
953,928,Gremlins 2: The New Batch,"young sweetheart billi and kate move to the big apple, land job in a high-tech offic park and soon reunit with the friendli and lovabl gizmo. but a seri of accid creat a whole new gener of gremlins. the situat worsen when the devilish green creatur invad a top-secret laboratori and develop genet alter powers, make them even harder to destroy! comedi horror fantasi new york monster skyscrap mutant restaur human anim relationship mutat tv station die and death water research station fur bat current electr shock clever gremlin cowardli zach galligan phoeb cate john glover joe dant"
954,205587,The Judge,"a success lawyer return to hi hometown for hi mother' funer onli to discov that hi estrang father, the town' judge, is suspect of murder. drama father son relationship judg lawyer robert duval robert downey jr. vera farmiga david dobkin"
955,6623,The Peacemaker,"when a train carri atom warhead mysteri crash in the former soviet union, a nuclear specialist discov the accid is realli part of a plot to cover up the theft of the weapons. assign to help her recov the miss bomb is a crack special forc colonel. action thriller helicopt terrorist nuclear missil bridg train crash train woman director georg clooney nicol kidman marcel iureș mimi leder"
956,1577,Resident Evil: Apocalypse,"as the citi is lock down under quarantine, alic join a small band of elit soldiers, enlist to rescu the miss daughter of the creator of the mutat t-virus. it' a heart-pound race against time as the group face off against hord of blood- thirsti zombies, stealthi lickers, mutant canin and the most sinist foe yet. horror action scienc fiction martial art mutant dystopia rescu conspiraci evil corpor zombi base on video game milla jovovich sienna guillori ode fehr alexand witt"
957,9801,Bridget Jones: The Edge of Reason,"bridget jone is becom uncomfort in her relationship with mark darcy. apart from discov that he' a conserv voter, she ha to deal with a new boss, a strang contractor and the worst vacat of her life. comedi romanc london england lovesick thailand clumsi fellow to drop brick captur woman director rené zellweg hugh grant colin firth beeban kidron"
958,2116,Out of Time,"matt lee whitlock, respect chief of polic in small banyan key, florida, must solv a viciou doubl homicid befor he himself fall under suspicion. matt lee ha to stay a few step ahead of hi own polic forc and everyon he' trust in order to find out the truth. thriller crime drama miami florida doubl murder divorc denzel washington eva mend sanaa lathan carl franklin"
959,9624,On Deadly Ground,"forrest taft is an environment agent who work for the aegi oil compani in alaska. aegi oil' corrupt ceo, michael jennings, is the kind of person who doesn't care whether or not oil spill into the ocean or onto the land, just as long as it' make money for him. action thriller fight inuit petrol compani alaska enviroment steven seagal michael cain joan chen steven seagal"
960,14199,The Adventures of Sharkboy and Lavagirl,"everyon alway knew that max had a wild imagination, but no one believ that hi wildest creation -- a boy rais by watch great white shark and a girl with the forc of a volcano -- were real. now, these two pint-siz action master will show max that even an ordinari kid ha what it take to be extraordinary. adventur famili scienc fiction imaginari friend outcast taylor lautner taylor dooley cayden boyd robert rodriguez"
961,1907,The Beach,"twenty-someth richard travel to thailand and find himself in possess of a strang map. rumour state that it lead to a solitari beach paradise, a tropic bliss - excit and intrigued, he set out to find it. drama adventur romanc thriller hippi exot island beach map group dynam shark attack leader thailand commun backpack delus marijuana youth shark extramarit affair leonardo dicaprio guillaum canet tilda swinton danni boyl"
962,4599,Raising Helen,"helen harri ha a glamorous, big-citi life work for one of new york' hottest model agencies. but suddenli her free-spirit life get turn upsid down when she must chose between the life she' alway loved, and the new love of her life! drama comedi romanc new york pastor world of fasion loss of parent mannequin fashion design famili relationship kate hudson john corbett joan cusack garri marshal"
963,22832,Ninja Assassin,"ninja assassin follow raizo (rain), one of the deadliest assassin in the world. taken from the street as a child, he wa transform into a train killer by the ozunu clan, a secret societi whose veri exist is consid a myth. but haunt by the merciless execut of hi friend by the clan, raizo break free from them and vanishes. now he waits, prepar to exact hi revenge. action crime thriller assassin assassin ninja fighter reveng ninja ninjutsu rain naomi harri sung kang jame mcteigu"
964,10390,For Love of the Game,"a basebal legend almost finish with hi distinguish career at the age of forti ha one last chanc to prove who he is, what he is capabl of, and win the heart of the woman he ha love for the past four years. drama romanc basebal trainer career legend train sport kevin costner kelli preston john c. reilli sam raimi"
965,9879,Striptease,"bounc from her job, erin grant need money if she' to have ani chanc of win back custodi of her child. but, eventually, she must confront the nake truth: to take on the system, she'll have to take it all off. erin strip to conquer, but she face unintend circumst when a hound dog of a congressman zero in on her and sharpen the shadi tool at hi fingertips, includ blackmail and murder. drama thriller crime blackmail strip club stripteas polic u.s. congress demi moor burt reynold armand assant andrew bergman"
966,38579,Marmaduke,"when phil and debbi winslow reloc from their nativ kansa to the sunni clime of orang county, their big-hearted, havoc-wreak great dane get a tast of the dog' life, california-style. famili comedi owen wilson emma stone georg lopez tom dey"
967,44603,Hereafter,"a supernatur thriller center on three peopl -- a blue-collar american, a french journalist and a london school boy -- who are touch by death in differ ways. drama fantasi matt damon bryce dalla howard georg mclaren clint eastwood"
968,11892,Murder by Numbers,"tenaci homicid detect cassi mayweath and her still-green partner are work a murder case, attempt to profil two malevol brilliant young men: cold, calcul killer whose dark secret might explain their crimes. crime drama thriller detect secret fbi homicid evid nerd vice intellectu high school partner murder rich forens sandra bullock ben chaplin ryan gosl barbet schroeder"
969,9691,Assassins,"assassin robert rath arriv at a funer to kill a promin mobster, onli to wit a rival hire gun complet the job for him -- with grisli results. horrifi by the murder of innoc bystanders, rath decid to take one last job and then return to civilian life. but find hi way out of the world of contract kill grow ever more danger as rath fall for hi femal target and becom a mark man himself. action adventur crime thriller competit assassin cia bank cat mexican standoff seattl hitman mission of murder hidden camera rivalri rescu shootout polic chase sniper rifl silenc doubl cross caribbean detroit michigan sylvest stallon antonio bandera juliann moor richard donner"
970,1248,Hannibal Rising,"the stori of the early, murder root of the cannibalist killer, hannib lecter – from hi hard-scrabbl lithuanian childhood, where he wit the repuls length to which hungri soldier will go to satiat themselves, through hi sojourn in france, where as a med student he hone hi appetit for the kill. crime drama thriller winter psychopath horror serial killer gaspard ulliel aaran thoma gong li peter webber"
971,12220,The Story of Us,ben and kati jordan are a marri coupl who go through hard time in fifteen year of marriage. comedi drama romanc love of one' life therapist psycholog wed relationship divorc bruce willi michel pfeiffer rob reiner rob reiner
972,72710,The Host,"a parasit alien soul is inject into the bodi of melani stryder. instead of carri out her race' mission of take over the earth, ""wanda"" (a she come to be called) form a bond with her host and set out to aid other free humans. action adventur romanc scienc fiction thriller base on novel mass murder dystopia genocid alien invas duringcreditssting interspeci romanc alien parasit saoirs ronan dian kruger jake abel andrew niccol"
973,1255,The Host,"a parasit alien soul is inject into the bodi of melani stryder. instead of carri out her race' mission of take over the earth, ""wanda"" (a she come to be called) form a bond with her host and set out to aid other free humans. action adventur romanc scienc fiction thriller base on novel mass murder dystopia genocid alien invas duringcreditssting interspeci romanc alien parasit song kang-ho park hae-il bae doona bong joon-ho"
974,10782,Basic,a dea agent investig the disappear of a legendari armi ranger drill sergeant and sever of hi cadet dure a train exercis gone sever awry. action drama mysteri thriller crime drug addict militari court panama militari servic court ranger suprem court lager militari crime john travolta conni nielsen samuel l. jackson john mctiernan
975,9573,Blood Work,"still recov from a heart transplant, a retir fbi profil return to servic when hi own blood analysi offer clue to the ident of a serial killer. crime drama mysteri thriller houseboat heart investig polic ex-cop suspens heart transplant fbi profil clint eastwood jeff daniel anjelica huston clint eastwood"
976,4959,The International,"an interpol agent and an attorney are determin to bring one of the world' most power bank to justice. uncov money laundering, arm trading, and conspiraci to destabil world governments, their investig take them from berlin, milan, new york and istanbul. find themselv in a chase across the globe, their relentless tenac put their own live at risk. drama thriller crime duringcreditssting clive owen naomi watt armin mueller-stahl tom tykwer"
977,10061,Escape from L.A.,"thi time, a cataclysm temblor hit lo angeles, turn it into an island. the presid view the quak as a sign from above, expel lo angel from the countri and make it a penal coloni for those found guilti of moral crimes. when hi daughter, part of a resist movement, steal the control unit for a doomsday weapon, snake again get tap to save the day. action adventur scienc fiction thriller prison usa presid earthquak dystopia attempt to escap lo angel reluct hero kurt russel staci keach steve buscemi john carpent"
978,10386,The Iron Giant,"in the small town of rockwell, main in octob 1957, a giant metal machin befriend a nine-year-old boy and ultim find it human by unselfishli save peopl from their own fear and prejudices. adventur anim famili fantasi scienc fiction cold war friendship giant robot sit on a toilet fear of unknown 1950 lax eli marienth jennif aniston vin diesel brad bird"
979,421,The Life Aquatic with Steve Zissou,we anderson’ incis quirki comedi build up star complex charact like in ‘the royal tenenbaums’ with bill murray on in the lead role. an ocean adventur documentari film maker zissou is put in all imagin life situat and a tough life crisi as he attempt to make a new film about captur the creatur that caus him pain. adventur comedi drama ocean film make loss of mother cynic red cap ship bill murray anjelica huston cate blanchett we anderson
